{
  "created_at": "2026-04-27T00:01:00Z",
  "evidence_status": "unknown",
  "family_role": "benchmark_opportunity",
  "filters": {},
  "information_need": "Find papers with explicit benchmark limitations or under-covered evaluation settings.",
  "input_hash": "sha256:2222222222222222222222222222222222222222222222222222222222222222",
  "parent_state_ids": [
    "research_spec:11111111"
  ],
  "planner": {
    "prompt": "You are generating retrieval queries for a research survey system.",
    "raw_intent": "graph reasoning with low compute benchmark leverage",
    "search_profile": {
      "constraints": [],
      "core_topic": "graph reasoning",
      "desired_properties": [
        "low compute",
        "benchmark leverage"
      ],
      "entities": [
        "graph reasoning",
        "scene graph"
      ],
      "non_goals": [
        "full-text extraction",
        "final idea generation",
        "experiment plan"
      ]
    }
  },
  "producer": {
    "name": "phase0-fixture",
    "run_id": "fixture",
    "version": "0.1.0"
  },
  "queries": [
    {
      "generation_reason": "Find graph reasoning benchmark leverage candidates for raw_intent: graph reasoning with low compute benchmark leverage",
      "intent": "Find benchmark leverage candidates.",
      "keyword_query": {
        "boost_phrases": [
          "graph reasoning",
          "scene graph",
          "benchmark evaluation"
        ],
        "optional_terms": [
          "low compute",
          "baseline",
          "dataset",
          "metric"
        ],
        "required_concepts": [
          [
            "graph reasoning",
            "scene graph",
            "graph"
          ],
          [
            "benchmark",
            "evaluation",
            "dataset"
          ]
        ]
      },
      "query_id": "q-benchmark",
      "query_type": "semantic_and_keyword",
      "semantic_text": "graph reasoning benchmark evaluation dataset low compute leverage",
      "text": "graph reasoning benchmark evaluation dataset low compute leverage"
    }
  ],
  "research_spec_id": "research_spec:11111111",
  "retrieval_mode": "keyword",
  "schema_version": "0.1.0",
  "state_id": "query_family:22222222"
}
